[
  {
    "ID": "T0001",
    "Page": 3,
    "Section": "招标文件正文.pdf｜第一章 招标公告 2.10",
    "Requirement Type": "Technical",
    "Requirement": "投标工程质量须达到合格标准。"
  },
  {
    "ID": "T0002",
    "Page": 3,
    "Section": "招标文件正文.pdf｜第一章 招标公告 2.7",
    "Requirement Type": "Schedule",
    "Requirement": "投标工期须响应420日历天。"
  },
  {
    "ID": "T0003",
    "Page": 4,
    "Section": "招标文件正文.pdf｜第一章 招标公告 3.1",
    "Requirement Type": "Qualification",
    "Requirement": "投标人须具备独立法人资格。"
  },
  {
    "ID": "T0004",
    "Page": 4,
    "Section": "招标文件正文.pdf｜第一章 招标公告 3.1",
    "Requirement Type": "Qualification",
    "Requirement": "投标人须具有建筑工程施工总承包贰级及以上资质。"
  },
  {
    "ID": "T0005",
    "Page": 4,
    "Section": "招标文件正文.pdf｜第一章 招标公告 3.2",
    "Requirement Type": "Document",
    "Requirement": "投标人业绩的竣工验收报告或验收表须有建设、施工、监理、设计四方盖章，至少一份证明材料须反映工程建筑面积。"
  },
  {
    "ID": "T0006",
    "Page": 4,
    "Section": "招标文件正文.pdf｜第一章 招标公告 3.2",
    "Requirement Type": "Document",
    "Requirement": "投标人业绩须提供合同或中标通知书，并提供竣工验收报告或竣工验收表。"
  },
  {
    "ID": "T0007",
    "Page": 4,
    "Section": "招标文件正文.pdf｜第一章 招标公告 3.2",
    "Requirement Type": "Qualification",
    "Requirement": "投标人须在开标之日起上推五年内完成单项合同建筑面积不低于40000平方米的工业厂房工程业绩。"
  },
  {
    "ID": "T0008",
    "Page": 4,
    "Section": "招标文件正文.pdf｜第一章 招标公告 3.3",
    "Requirement Type": "Qualification",
    "Requirement": "拟派项目经理不得在其他项目任职，但能够在本项目中标后从原项目调整至本项目的除外。"
  },
  {
    "ID": "T0009",
    "Page": 4,
    "Section": "招标文件正文.pdf｜第一章 招标公告 3.3",
    "Requirement Type": "Qualification",
    "Requirement": "拟派项目经理须具有建筑工程专业一级注册建造师资格。"
  },
  {
    "ID": "T0010",
    "Page": 4,
    "Section": "招标文件正文.pdf｜第一章 招标公告 3.3",
    "Requirement Type": "Qualification",
    "Requirement": "拟派项目经理须具有有效的安全生产考核合格B类证书。"
  },
  {
    "ID": "T0011",
    "Page": 4,
    "Section": "招标文件正文.pdf｜第一章 招标公告 3.5.1",
    "Requirement Type": "Qualification",
    "Requirement": "投标人不得处于宣城市各级工程建设主管部门或其他履职部门不良行为记录披露期。"
  },
  {
    "ID": "T0012",
    "Page": 4,
    "Section": "招标文件正文.pdf｜第一章 招标公告 3.5.2",
    "Requirement Type": "Qualification",
    "Requirement": "投标人不得处于宣城市各级公共资源交易综合管理部门不良行为记录披露期。"
  },
  {
    "ID": "T0013",
    "Page": 4,
    "Section": "招标文件正文.pdf｜第一章 招标公告 3.5.3",
    "Requirement Type": "Qualification",
    "Requirement": "投标人不得处于设区市级及以上工程建设主管部门或公共资源交易综合管理部门明文限制投标期限内；所属子公司的不良记录不影响投标人资格。"
  },
  {
    "ID": "T0014",
    "Page": 4,
    "Section": "招标文件正文.pdf｜第一章 招标公告 3.6",
    "Requirement Type": "Qualification",
    "Requirement": "本项目不接受联合体投标。"
  },
  {
    "ID": "T0015",
    "Page": 4,
    "Section": "招标文件正文.pdf｜第一章 招标公告 3.7.1",
    "Requirement Type": "Document",
    "Requirement": "投标文件须提供合同附件15考勤承诺书和附件16考勤人员组成表。"
  },
  {
    "ID": "T0016",
    "Page": 4,
    "Section": "招标文件正文.pdf｜第一章 招标公告 3.7.1",
    "Requirement Type": "Document",
    "Requirement": "投标时须在考勤人员组成表中注明项目经理、技术负责人、施工员、质量员、安全员等考勤人员信息。"
  },
  {
    "ID": "T0017",
    "Page": 5,
    "Section": "招标文件正文.pdf｜第一章 招标公告 3.7.2",
    "Requirement Type": "Consistency",
    "Requirement": "参加答辩的项目经理须与投标文件中拟派项目经理一致。"
  },
  {
    "ID": "T0018",
    "Page": 5,
    "Section": "招标文件正文.pdf｜第一章 招标公告 3.7.2",
    "Requirement Type": "Scoring",
    "Requirement": "项目经理未按要求参加答辩的，该答辩评分为零分。"
  },
  {
    "ID": "T0019",
    "Page": 5,
    "Section": "招标文件正文.pdf｜第一章 招标公告 7",
    "Requirement Type": "Commercial",
    "Requirement": "投标保证金可采用纸质或电子保函、保证保险、担保保函，或现金电汇、转账方式缴纳。"
  },
  {
    "ID": "T0020",
    "Page": 6,
    "Section": "招标文件正文.pdf｜第一章 招标公告 7",
    "Requirement Type": "Commercial",
    "Requirement": "投标保证金金额为人民币500000元。"
  },
  {
    "ID": "T0021",
    "Page": 8,
    "Section": "招标文件正文.pdf｜第二章 前附表 1.3.3",
    "Requirement Type": "Technical",
    "Requirement": "投标工程质量标准为合格。"
  },
  {
    "ID": "T0022",
    "Page": 9,
    "Section": "招标文件正文.pdf｜第二章 前附表 1.11.1",
    "Requirement Type": "Qualification",
    "Requirement": "本项目不允许分包。"
  },
  {
    "ID": "T0023",
    "Page": 10,
    "Section": "招标文件正文.pdf｜第二章 前附表 3.2.1",
    "Requirement Type": "Commercial",
    "Requirement": "投标报价须按一般计税方法计税，开具增值税专用发票。"
  },
  {
    "ID": "T0024",
    "Page": 11,
    "Section": "招标文件正文.pdf｜第二章 前附表 3.3.1",
    "Requirement Type": "Schedule",
    "Requirement": "投标有效期为投标文件递交截止之日起90日。"
  },
  {
    "ID": "T0025",
    "Page": 11,
    "Section": "招标文件正文.pdf｜第二章 前附表 3.4.1",
    "Requirement Type": "Commercial",
    "Requirement": "投标保证金为人民币500000元，可采用现金电汇或转账、纸质银行保函、电子保函方式提交。"
  },
  {
    "ID": "T0026",
    "Page": 11,
    "Section": "招标文件正文.pdf｜第二章 投标人须知",
    "Requirement Type": "Commercial",
    "Requirement": "如采用现金转账或电汇，投标保证金须从投标人基本账户足额转出，汇款人名称须与投标人一致，不得由其他组织或个人账户代汇。"
  },
  {
    "ID": "T0027",
    "Page": 11,
    "Section": "招标文件正文.pdf｜第二章 投标人须知",
    "Requirement Type": "Document",
    "Requirement": "如采用纸质银行保函，投标文件须附基本账户开户许可证扫描件或开户银行基本存款账户信息，并按格式承诺真实有效。"
  },
  {
    "ID": "T0028",
    "Page": 11,
    "Section": "招标文件正文.pdf｜第二章 投标人须知",
    "Requirement Type": "Document",
    "Requirement": "如采用纸质银行保函，投标文件须附纸质银行保函复印件或影印件。"
  },
  {
    "ID": "T0029",
    "Page": 11,
    "Section": "招标文件正文.pdf｜第二章 投标人须知",
    "Requirement Type": "Commercial",
    "Requirement": "如采用纸质银行保函，须由投标人基本账户开户行出具见索即付无条件银行保函。"
  },
  {
    "ID": "T0030",
    "Page": 12,
    "Section": "招标文件正文.pdf｜第二章 前附表 3.7.1",
    "Requirement Type": "Document",
    "Requirement": "暗标施工组织设计不得出现单位或个人名称及其他明显标志；除施工总平面图和必要示意图外，不得出现实景照片、彩色字体或标识。"
  },
  {
    "ID": "T0031",
    "Page": 12,
    "Section": "招标文件正文.pdf｜第二章 前附表 3.7.1",
    "Requirement Type": "Document",
    "Requirement": "暗标施工组织设计的章节标题须统一使用三号宋体且不加粗，正文须使用四号宋体且不加粗，表格须使用五号宋体且不加粗。"
  },
  {
    "ID": "T0032",
    "Page": 12,
    "Section": "招标文件正文.pdf｜第二章 投标人须知",
    "Requirement Type": "Commercial",
    "Requirement": "如本项目前次招标失败且参加本次招标，须向本次公告公布的保证金账户重新缴纳投标保证金。"
  },
  {
    "ID": "T0033",
    "Page": 12,
    "Section": "招标文件正文.pdf｜第二章 投标人须知",
    "Requirement Type": "Document",
    "Requirement": "本项目不允许递交备选投标方案。"
  },
  {
    "ID": "T0034",
    "Page": 13,
    "Section": "招标文件正文.pdf｜第二章 前附表 3.7.1",
    "Requirement Type": "Document",
    "Requirement": "暗标施工组织设计全文不得超过120页，超出页数不予评审。"
  },
  {
    "ID": "T0035",
    "Page": 15,
    "Section": "招标文件正文.pdf｜第二章 前附表 10.3",
    "Requirement Type": "Document",
    "Requirement": "选用招标人推荐品牌以外材料、设备品牌时，须在报价文件的材料品牌响应表注明，并提供技术性能指标、业绩等资料。"
  },
  {
    "ID": "T0036",
    "Page": 16,
    "Section": "招标文件正文.pdf｜第二章 前附表 10.4",
    "Requirement Type": "Commercial",
    "Requirement": "投标报价须包含关键岗位考勤相关费用。"
  },
  {
    "ID": "T0037",
    "Page": 18,
    "Section": "招标文件正文.pdf｜第二章 前附表 10.9",
    "Requirement Type": "Document",
    "Requirement": "拟派项目经理现任其他项目经理但拟中标后调任本项目的，投标文件须承诺合同签订前能够变更至本项目并全面履约。"
  },
  {
    "ID": "T0038",
    "Page": 19,
    "Section": "招标文件正文.pdf｜第二章 前附表 12",
    "Requirement Type": "Document",
    "Requirement": "投标文件须严格按照第八章投标文件格式编制。"
  },
  {
    "ID": "T0039",
    "Page": 21,
    "Section": "招标文件正文.pdf｜第二章 投标人须知",
    "Requirement Type": "Qualification",
    "Requirement": "投标人须持有效安全生产许可证。"
  },
  {
    "ID": "T0040",
    "Page": 21,
    "Section": "招标文件正文.pdf｜第二章 投标人须知",
    "Requirement Type": "Qualification",
    "Requirement": "投标人须持有效营业执照。"
  },
  {
    "ID": "T0041",
    "Page": 21,
    "Section": "招标文件正文.pdf｜第二章 投标人须知",
    "Requirement Type": "Qualification",
    "Requirement": "投标人须持符合招标公告要求的有效资质证书。"
  },
  {
    "ID": "T0042",
    "Page": 21,
    "Section": "招标文件正文.pdf｜第二章 投标人须知",
    "Requirement Type": "Document",
    "Requirement": "投标人须提供安全生产许可证。"
  },
  {
    "ID": "T0043",
    "Page": 21,
    "Section": "招标文件正文.pdf｜第二章 投标人须知",
    "Requirement Type": "Document",
    "Requirement": "投标人须提供营业执照。"
  },
  {
    "ID": "T0044",
    "Page": 21,
    "Section": "招标文件正文.pdf｜第二章 投标人须知",
    "Requirement Type": "Document",
    "Requirement": "投标人须提供资质证书。"
  },
  {
    "ID": "T0045",
    "Page": 23,
    "Section": "招标文件正文.pdf｜第二章 投标人须知",
    "Requirement Type": "Document",
    "Requirement": "已完成资格业绩须提供合同。"
  },
  {
    "ID": "T0046",
    "Page": 23,
    "Section": "招标文件正文.pdf｜第二章 投标人须知",
    "Requirement Type": "Document",
    "Requirement": "已完成资格业绩须提供有建设、施工、监理和设计四方盖章的竣工验收报告或竣工验收表。"
  },
  {
    "ID": "T0047",
    "Page": 23,
    "Section": "招标文件正文.pdf｜第二章 投标人须知",
    "Requirement Type": "Consistency",
    "Requirement": "资格业绩证明材料与监管部门备案资料应保持一致；如有备案资料，以备案资料为准。"
  },
  {
    "ID": "T0048",
    "Page": 23,
    "Section": "招标文件正文.pdf｜第二章 投标人须知",
    "Requirement Type": "Document",
    "Requirement": "资格业绩须在商务文件“资格审查资料”的类似项目情况表中注明并提供相关证明材料。"
  },
  {
    "ID": "T0049",
    "Page": 23,
    "Section": "招标文件正文.pdf｜第二章 附录3",
    "Requirement Type": "Document",
    "Requirement": "已完成资格业绩可提供合同或中标通知书，并须提供竣工验收报告或竣工验收表。"
  },
  {
    "ID": "T0050",
    "Page": 23,
    "Section": "招标文件正文.pdf｜第二章 附录3",
    "Requirement Type": "Document",
    "Requirement": "资格业绩的至少一份证明材料须反映工业厂房建筑面积。"
  },
  {
    "ID": "T0051",
    "Page": 24,
    "Section": "招标文件正文.pdf｜第二章 投标人须知",
    "Requirement Type": "Qualification",
    "Requirement": "投标人在投标截止时不得处于宣城市公共资源交易综合管理部门不良行为披露期。"
  },
  {
    "ID": "T0052",
    "Page": 24,
    "Section": "招标文件正文.pdf｜第二章 投标人须知",
    "Requirement Type": "Qualification",
    "Requirement": "投标人在投标截止时不得处于宣城市工程建设主管部门或其他履职部门不良行为披露期。"
  },
  {
    "ID": "T0053",
    "Page": 24,
    "Section": "招标文件正文.pdf｜第二章 投标人须知",
    "Requirement Type": "Qualification",
    "Requirement": "投标人在投标截止时不得处于设区市级及以上主管部门明文限制投标期限内；所属子公司不良记录不影响本项资格。"
  },
  {
    "ID": "T0054",
    "Page": 25,
    "Section": "招标文件正文.pdf｜第二章 投标人须知",
    "Requirement Type": "Document",
    "Requirement": "如要求项目经理职称，须提供职称证书。"
  },
  {
    "ID": "T0055",
    "Page": 25,
    "Section": "招标文件正文.pdf｜第二章 投标人须知",
    "Requirement Type": "Document",
    "Requirement": "投标人须提供项目经理安全生产B证。"
  },
  {
    "ID": "T0056",
    "Page": 25,
    "Section": "招标文件正文.pdf｜第二章 投标人须知",
    "Requirement Type": "Document",
    "Requirement": "投标人须提供项目经理注册建造师证书。"
  },
  {
    "ID": "T0057",
    "Page": 25,
    "Section": "招标文件正文.pdf｜第二章 投标人须知",
    "Requirement Type": "Document",
    "Requirement": "投标人须提供项目经理身份证。"
  },
  {
    "ID": "T0058",
    "Page": 25,